{
  "diff_type": "StateDiff",
  "schema_version": "0.1",
  "diff_id": "state-diff-t000-aster-r2-heat-alarm",
  "tick": 0,
  "source_action_trace_id": "system-t0-tick",
  "changes": [
    {
      "path": "/sectors/Aster/systems/R2/metrics/gridLoad/value",
      "old": 0.68,
      "new": 0.73,
      "visibility": "public_observable"
    },
    {
      "path": "/sectors/Aster/systems/R2/metrics/thermalDebt/value",
      "old": 0.41,
      "new": 0.46,
      "visibility": "hidden"
    }
  ],
  "deterministic_seed": 42
}
