{
  "diff_type": "StateDiff",
  "schema_version": "0.1",
  "diff_id": "state-diff-001",
  "tick": 9,
  "source_action_trace_id": "action-trace-001",
  "changes": [
    {
      "path": "/sectors/aster/r2/alarm_acknowledged",
      "old": false,
      "new": true,
      "visibility": "issuer_observable"
    }
  ],
  "deterministic_seed": 42
}
